{
  "owner": "alunduil",
  "title": "Inbox",
  "login": "alunduil",
  "fields": [
    {
      "name": "Status",
      "type": "SINGLE_SELECT",
      "options": [
        {
          "id": "8080c408",
          "name": "Backlog",
          "color": "GRAY",
          "description": "Not started"
        },
        {
          "name": "In progress",
          "color": "BLUE",
          "description": "My move on my own work"
        },
        {
          "name": "Drafts",
          "color": "ORANGE",
          "description": "My draft PRs"
        },
        {
          "id": "bcc940da",
          "name": "Needs me",
          "color": "YELLOW",
          "description": "My review or merge"
        },
        {
          "name": "Waiting on others",
          "color": "PURPLE",
          "description": "Someone else's move"
        },
        {
          "name": "Blocked",
          "color": "RED",
          "description": "Blocked by an open issue"
        },
        {
          "id": "c090564c",
          "name": "Closed",
          "color": "GREEN",
          "description": "Done"
        }
      ]
    },
    {
      "name": "Filed by",
      "type": "TEXT"
    }
  ],
  "filed_by_field": "Filed by",
  "status_field": "Status",
  "sources": [
    { "type": "owner", "logins": ["alunduil", "dungeon-studio", "qua-world"] },
    { "type": "author", "login": "alunduil" },
    { "type": "assignee", "login": "alunduil" }
  ]
}
